vocab_id,label,override_kind,reject_tgn,accept_tgn,lat,lon,placetype_aat,reviewed_by,reviewed_at,evidence
2305024,Ohio,reconciled_review_accepted,1034723,7007706,40.0,-80.8333,http://vocab.getty.edu/aat/300000776,arno,2026-05-10,"68 artworks reference Cuyahoga Falls/Middletown/Cleveland Ohio; co-tagged Pittsburgh PA, Philadelphia, Buffalo NY, Chicago, California; Civil War 1865-67 context. Rijks broader_id chain: Ohio -> United States of America. Rijks dump's TGN equivalent (1034723) contradicts Rijks's own broader_id and artwork descriptions."
23019133,Montmorency,reconciled_review_accepted,7009368,7013077,46.8667,-71.2,http://vocab.getty.edu/aat/300008347,arno,2026-05-10,"Single artwork RP-F-2001-7-699-1 by William Notman titled 'Natural Steps Montmorenci near Quebec'; co-tagged Quebec (Canada) as production_place + spatial. Rijks broader_id chain reaches Canada. Rijks dump's TGN equivalent (7009368) is the French commune, contradicting both."
2303521,Bournemouth,reconciled_review_accepted,7010737,7011274,50.716667,-1.883333,http://vocab.getty.edu/aat/300008347,arno,2026-05-10,"40 artworks including 'strand en pier bij Bournemouth, Engeland'; James Valentine (Scottish photographer); Branksome Tower (suburb of Poole, adjacent to Bournemouth UK). Rijks broader chain: Bournemouth -> England -> Great Britain -> UK. Rijks dump's TGN equivalent (7010737) contradicts both."
2301618,Place de la Concorde,manual_centroid,,,48.8656331,2.3212357,http://vocab.getty.edu/aat/300008304,arno,2026-05-10,"Curator-supplied centroid for an areal entity. TGN 7544568 correctly classifies Place de la Concorde as a square (no point centroid in TGN); apply_tgn_areal_flag.py earlier set is_areal=1. For downstream rendering a single-point coord is acceptable. Coord copied from Wikidata Q189503's P625 = (48.8656331 2.3212357). This override resets is_areal=0 and locks coord_method='manual'."
230885,Cape of Good Hope,manual_centroid,,,-34.3568,18.4734,http://vocab.getty.edu/aat/300008850,arno,2026-05-10,"Curator-supplied centroid for an areal entity. Existing DB coord (-31.0 23.0) was wildly off (interior of South Africa); TGN 7000877 classifies the cape as areal with no centroid. Coord set to the actual cape (-34.3568 18.4734) at the southern tip of the Cape Peninsula. This override resets is_areal=0 and locks coord_method='manual'."
23029377,Ariano Irpino,manual_centroid,,,41.15277778,15.08888889,http://vocab.getty.edu/aat/300008057,arno,2026-05-10,"Existing DB coord (42.89 -2.99) lands in Basque Country Spain — wildly wrong. The DB label 'Arriano' is a typo / archaic spelling for Ariano Irpino, an Italian town in Avellino province Campania (NOT Lazio as DB's broader_id chain says — that's a separate hierarchy bug). Identification confirmed by inscription on RP-T-00-492-44 (Louis Ducros 1778): 'Vue de la Ville d'Arriano (Equotuticum)' — Equotuticum is the ancient Roman name associated with this area. Reference image: https://en.wikipedia.org/wiki/Ariano_Irpino#/media/File:Veduta_della_città_di_Ariano.jpg shows the same scene Ducros depicted. Coord (41.15277778 15.08888889) per Wikipedia / Wikidata Q55000."
23010302,Lago d'Agnano,manual_centroid,,,40.82974,14.17045,http://vocab.getty.edu/aat/300387336,arno,2026-05-10,"Existing DB coord (-54.67 -68.0) lands in Tierra del Fuego Patagonia — wildly wrong. Identification confirmed by attached artwork RP-F-F18082 'Gebouw aan het meer van Agnano nabij Napels Italië' (Building at Lake Agnano near Naples Italy) by Giorgio Sommer (1863-1914). Lago d'Agnano is the volcanic crater lake in the Phlegraean Fields near Naples (drained in 1870). Coord (40.82974 14.17045) per Wikidata Q3413605."
23022947,Cana,manual_centroid,,,32.75,35.35,http://vocab.getty.edu/aat/300008537,arno,2026-05-10,"Existing DB coord (42.80 11.42) lands in Tuscany Italy — wildly wrong. Multiple attached artworks explicitly identify biblical Cana in Galilee Israel: RP-F-F13040 'Gezicht op een water bij Cana Israël', RP-F-F13041 'Gezicht op Cana Israël', RP-F-2001-7-1584-9 'Gezicht op Cana te Galilee' by Horatio Herbert Kitchener (who led the 1874-77 Survey of Western Palestine), RP-F-2001-7-1659-88 by Félix Bonfils (the famous Holy Land photographer). Coord (32.75 35.35) per Wikidata Q2633158 (Kafr Kanna — the modern Arab village traditionally identified as biblical Cana)."
