vocab_id,authority,id,uri,reviewed_by,reviewed_at,evidence
130561,wikidata,Q1740301,http://www.wikidata.org/entity/Q1740301,arno,2026-05-10,"Wikidata 'Kew' (suburb of London Borough of Richmond upon Thames). Verified via Wikidata's own P1667 (TGN ID) which equals 4005652, matching the DB's existing TGN entry. Recovers the Wikidata equivalent the v0.25 snapshot backfill assumed but the current harvest didn't carry."
130561,geonames,2645740,https://sws.geonames.org/2645740/,arno,2026-05-10,"GeoNames 'Kew' (suburb), referenced from Wikidata Q1740301's P1566. Coord 51.4837 -0.2780 matches Kew, London."
2301118,wikidata,Q9924,http://www.wikidata.org/entity/Q9924,arno,2026-05-10,"Wikidata 'Haarlemmermeer' (Dutch municipality / former lake). Verified via Wikidata's P1667 = 1112001, matching the DB's existing TGN entry. Coord 52.30 4.67 matches Haarlemmermeer."
2301118,geonames,2754999,https://sws.geonames.org/2754999/,arno,2026-05-10,"GeoNames 'Haarlemmermeer' (municipality), referenced from Wikidata Q9924's P1566."
2304716,wikidata,Q664892,http://www.wikidata.org/entity/Q664892,arno,2026-05-10,"Wikidata 'Roxburghshire' (historic county in Southern Uplands of Scotland). DB label is 'Boxburghshire' which is almost certainly a B/R typo. Identified by broader chain (Schotland -> GB -> UK) + only Roxburghshire-named candidate among Wikidata search hits. Wikidata Q664892 has no P1667 set, so cannot cross-verify with the DB's TGN 7002444 — but coord 55.57 -2.48 is correct for the historic county."
2304716,geonames,2639033,https://sws.geonames.org/2639033/,arno,2026-05-10,"GeoNames 'Roxburghshire', referenced from Wikidata Q664892's P1566."
